<<<<<<< Updated upstream
{"Ann\u00e9e":1921,"id_category":2,"Date_de_naissance":"1877-09-02","Date_de_mort":"1956-09-22","Born_country":"United Kingdom","Born_city":"Eastbourne","Died_country":"United Kingdom","Died_city":"Brighton","Gender":"male","biographie":"Frederick Soddy (2 septembre 1877 \u00e0 Eastbourne, Angleterre - 22 septembre 1956 \u00e0 Brighton, Angleterre) est un radio-chimiste britannique, laur\u00e9at du prix Nobel de chimie en 1921.\r\n\r\n\r\n== Biographie ==\r\nSoddy est n\u00e9 \u00e0 Eastbourne en Angleterre. Il commence ses \u00e9tudes au Eastbourne College, avant d'aller \u00e0 l'universit\u00e9 du pays de Galles \u00e0 Aberystwyth et \u00e0 l'universit\u00e9 d'Oxford (au Merton College). Il est chercheur \u00e0 Oxford de 1898 \u00e0 1900.\r\nEn 1900, il devient d\u00e9monstrateur de chimie \u00e0 l'universit\u00e9 McGill \u00e0 Montr\u00e9al au Qu\u00e9bec, o\u00f9 il travaille avec Ernest Rutherford sur la radioactivit\u00e9. Ils d\u00e9couvrent que le comportement anormal des \u00e9l\u00e9ments radioactifs provient de leur d\u00e9sint\u00e9gration en d'autres \u00e9l\u00e9ments. Cette d\u00e9sint\u00e9gration produit aussi des rayons alpha, b\u00eata et gamma.\r\nEn 1903, avec William Ramsay, Soddy v\u00e9rifie que la d\u00e9sint\u00e9gration du radium produit de l'h\u00e9lium.\r\nDe 1904 \u00e0 1914, il est charg\u00e9 de cours \u00e0 l'universit\u00e9 de Glasgow et montre que l'uranium peut se d\u00e9sint\u00e9grer en radium. Il montre aussi qu'un \u00e9l\u00e9ment radioactif peut avoir plusieurs masses atomiques sans autre changement dans ses propri\u00e9t\u00e9s chimiques. Ceci conduit \u00e0 la notion d'isotope. Soddy montre plus tard que les \u00e9l\u00e9ments non radioactifs peuvent aussi avoir plusieurs isotopes. De plus, il montre que l'\u00e9mission alpha diminue de deux unit\u00e9s le nombre atomique. C'est une \u00e9tape fondamentale dans la compr\u00e9hension des relations entre les diff\u00e9rentes familles d'\u00e9l\u00e9ments radioactifs.\r\nEn 1914, il est nomm\u00e9 \u00e0 une chaire de l'universit\u00e9 d'Aberdeen.\r\nEn 1919, il s'installe \u00e0 Oxford, o\u00f9 il r\u00e9organise les laboratoires et le cursus en chimie jusqu'en 1936.\r\nIl re\u00e7oit en 1921 le prix Nobel de chimie \u00ab pour ses contributions \u00e0 notre connaissance de la chimie des substances radioactives, et ses recherches \u00e0 propos de l'origine et la nature des isotopes \u00bb.\r\nDans quatre livres \u00e9crits de 1921 \u00e0 1934, Soddy mena campagne pour une r\u00e9forme radicale des relations mon\u00e9taires mondiales, fondant sa vision de l'\u00e9conomie \u00e9cologique sur les lois de la thermodynamique, mais ne fut pas pris au s\u00e9rieux. Quoique, sans pour autant en \u00eatre l'instigateur, la plupart de ses propositions \u2014 l'abandon de l'\u00e9talon-or, les taux de change flottants, l'utilisation des surplus et d\u00e9ficits nationaux comme outils de politique macro-\u00e9conomique pour contrer les cycles \u00e9conomiques, et la mise en place de bureaux de statistiques \u00e9conomiques (incluant un indice des prix \u00e0 la consommation) pour faciliter cet effort \u2014 soient maintenant de pratique conventionnelle, sa critique du syst\u00e8me de r\u00e9serves fractionnaires reste controvers\u00e9e (mais reprise par de nombreux \u00e9conomistes comme Irving Fisher \u2014 dans 100 % monnaie \u2014 ou Maurice Allais). Soddy \u00e9crivait que les dettes financi\u00e8res croissaient exponentiellement au taux de l'int\u00e9r\u00eat compos\u00e9 mais que l'\u00e9conomie r\u00e9elle \u00e9tait bas\u00e9e sur des stocks non renouvelables de combustibles fossiles. L'\u00e9nergie obtenue par l'utilisation des combustibles fossiles ne pouvait pas \u00eatre r\u00e9utilis\u00e9e. Cette critique de la croissance \u00e9conomique trouve un \u00e9cho dans les travaux de Nicholas Georgescu-Roegen.\r\nIl est mort le 22 septembre 1956 \u00e0 Brighton en Angleterre. Son \u00e9pouse est d\u00e9c\u00e9d\u00e9e en 1936.\r\n\r\n\r\n== Publications ==\r\nRadioactivity (1904)\r\nThe Interpretation of Radium (1909)\r\nThe Chemistry of the Radioactive Elements (1912-1914)\r\nMatter and Energy (1912)\r\nScience and Life (1920)\r\nWealth, Virtual Wealth and Debt. The solution of the economic paradox (George Allen & Unwin, 1926)\r\nThe Interpretation of the Atom (1932)\r\nMoney versus Man (1933)\r\nMoney as nothing for something ; The gold \"standard\" snare (1935)\r\nPresent outlook, a warning : debasement of the currency, deflation and unemployment (1944)\r\nThe Story of Atomic Energy (1949)\r\nAtomic Transmutation (1953)\r\n\r\n\r\n== Notes et r\u00e9f\u00e9rences ==\r\n\r\n\r\n== Voir aussi ==\r\n\r\n\r\n=== Bibliographie ===\r\n(en) Biographie sur le site des prix Nobel\r\n\r\n\r\n=== Articles connexes ===\r\nAda Hitchins\r\nLoi de Soddy\r\nTh\u00e9or\u00e8me de Soddy\r\nHexlet de Soddy\r\nLoi de d\u00e9placement radioactif de Fajans et Soddy\r\n\r\n\r\n=== Liens externes ===\r\n(en) Biographie sur le site de la fondation Nobel (le bandeau sur la page comprend plusieurs liens relatifs \u00e0 la remise du prix, dont un document r\u00e9dig\u00e9 par la personne laur\u00e9ate \u2014 le Nobel Lecture \u2014 qui d\u00e9taille ses apports)\r\nL'article de Rutherford et Soddy (1903) mettant en \u00e9vidence la d\u00e9croissance radioactive, sur le site Bibnum\r\n\r\nRessources relatives \u00e0 la recherche : Biodiversity Heritage Library Scopus \r\nRessource relative aux beaux-arts : National Portrait Gallery \r\nRessource relative \u00e0 la musique : MusicBrainz \r\n Portail de la chimie   Portail du prix Nobel   Portail du Royaume-Uni","mots_cles":"frederick;soddy;2;septembre;1877;a;eastbourne;angleterre;;22;septembre;1956;a;brighton;angleterre;est;un;radiochimiste;britannique;laureat;du;prix;nobel;de;chimie;en;1921;;biographie;;soddy;est;ne;a;eastbourne;en;angleterre;il;commence;ses;etudes;au;eastbourne;college;avant;daller;a;luniversite;du;pays;de;galles;a;aberystwyth;et;a;luniversite;doxford;au;merton;college;il;est;chercheur;a;oxford;de;1898;a;1900;en;1900;il;devient;demonstrateur;de;chimie;a;luniversite;mcgill;a;montreal;au;quebec;ou;il;travaille;avec;ernest;rutherford;sur;la;radioactivite;ils;decouvrent;que;le;comportement;anormal;des;elements;radioactifs;provient;de;leur;desintegration;en;dautres;elements;cette;desintegration;produit;aussi;des;rayons;alpha;beta;et;gamma;en;1903;avec;william;ramsay;soddy;verifie;que;la;desintegration;du;radium;produit;de;lhelium;de;1904;a;1914;il;est;charge;de;cours;a;luniversite;de;glasgow;et;montre;que;luranium;peut;se;desintegrer;en;radium;il;montre;aussi;quun;element;radioactif;peut;avoir;plusieurs;masses;atomiques;sans;autre;changement;dans;ses;proprietes;chimiques;ceci;conduit;a;la;notion;disotope;soddy;montre;plus;tard;que;les;elements;non;radioactifs;peuvent;aussi;avoir;plusieurs;isotopes;de;plus;il;montre;que;lemission;alpha;diminue;de;deux;unites;le;nombre;atomique;cest;une;etape;fondamentale;dans;la;comprehension;des;relations;entre;les;differentes;familles;delements;radioactifs;en;1914;il;est;nomme;a;une;chaire;de;luniversite;daberdeen;en;1919;il;sinstalle;a;oxford;ou;il;reorganise;les;laboratoires;et;le;cursus;en;chimie;jusquen;1936;il;recoit;en;1921;le;prix;nobel;de;chimie;;pour;ses;contributions;a;notre;connaissance;de;la;chimie;des;substances;radioactives;et;ses;recherches;a;propos;de;lorigine;et;la;nature;des;isotopes;;dans;quatre;livres;ecrits;de;1921;a;1934;soddy;mena;campagne;pour;une;reforme;radicale;des;relations;monetaires;mondiales;fondant;sa;vision;de;leconomie;ecologique;sur;les;lois;de;la;thermodynamique;mais;ne;fut;pas;pris;au;serieux;quoique;sans;pour;autant;en;etre;linstigateur;la;plupart;de;ses;propositions;;labandon;de;letalonor;les;taux;de;change;flottants;lutilisation;des;surplus;et;deficits;nationaux;comme;outils;de;politique;macroeconomique;pour;contrer;les;cycles;economiques;et;la;mise;en;place;de;bureaux;de;statistiques;economiques;incluant;un;indice;des;prix;a;la;consommation;pour;faciliter;cet;effort;;soient;maintenant;de;pratique;conventionnelle;sa;critique;du;systeme;de;reserves;fractionnaires;reste;controversee;mais;reprise;par;de;nombreux;economistes;comme;irving;fisher;;dans;100;;monnaie;;ou;maurice;allais;soddy;ecrivait;que;les;dettes;financieres;croissaient;exponentiellement;au;taux;de;linteret;compose;mais;que;leconomie;reelle;etait;basee;sur;des;stocks;non;renouvelables;de;combustibles;fossiles;lenergie;obtenue;par;lutilisation;des;combustibles;fossiles;ne;pouvait;pas;etre;reutilisee;cette;critique;de;la;croissance;economique;trouve;un;echo;dans;les;travaux;de;nicholas;georgescuroegen;il;est;mort;le;22;septembre;1956;a;brighton;en;angleterre;son;epouse;est;decedee;en;1936;;publications;;radioactivity;1904;the;interpretation;of;radium;1909;the;chemistry;of;the;radioactive;elements;19121914;matter;and;energy;1912;science;and;life;1920;wealth;virtual;wealth;and;debt;the;solution;of;the;economic;paradox;george;allen;;unwin;1926;the;interpretation;of;the;atom;1932;money;versus;man;1933;money;as;nothing;for;something;;the;gold;standard;snare;1935;present;outlook;a;warning;;debasement;of;the;currency;deflation;and;unemployment;1944;the;story;of;atomic;energy;1949;atomic;transmutation;1953;;notes;et;references;;;voir;aussi;;;bibliographie;;en;biographie;sur;le;site;des;prix;nobel;;articles;connexes;;ada;hitchins;loi;de;soddy;theoreme;de;soddy;hexlet;de;soddy;loi;de;deplacement;radioactif;de;fajans;et;soddy;;liens;externes;;en;biographie;sur;le;site;de;la;fondation;nobel;le;bandeau;sur;la;page;comprend;plusieurs;liens;relatifs;a;la;remise;du;prix;dont;un;document;redige;par;la;personne;laureate;;le;nobel;lecture;;qui;detaille;ses;apports;larticle;de;rutherford;et;soddy;1903;mettant;en;evidence;la;decroissance;radioactive;sur;le;site;bibnum;ressources;relatives;a;la;recherche;;biodiversity;heritage;library;scopus;ressource;relative;aux;beauxarts;;national;portrait;gallery;ressource;relative;a;la;musique;;musicbrainz;portail;de;la;chimie;portail;du;prix;nobel;portail;du;royaumeuni","nom_organisation":"University of Oxford","ville_organisation":"Oxford","pays_organisation":"United Kingdom"}
=======
{"Ann\u00e9e":1974,"id_category":6,"Date_de_naissance":"1898-08-24","Date_de_mort":"1983-05-22","Born_country":"Belgium","Born_city":"Longlier","Died_country":"Belgium","Died_city":"Brussels","Gender":"male","biographie":"Albert Claude, n\u00e9 le 23 ao\u00fbt 1898 \u00e0 Longlier en Belgique et mort le 22 mai 1983 \u00e0 Ixelles en Belgique, est un biochimiste belge naturalis\u00e9 am\u00e9ricain en 1941. \r\nPr\u00e9curseur dans le domaine de la biologie mol\u00e9culaire, il est le cor\u00e9cipiendaire, en 1974, du prix Nobel de physiologie ou m\u00e9decine avec Christian de Duve et George Emil Palade, pour leur d\u00e9couverte d'ultra-structures cellulaires.\r\n\r\n\r\n== Biographie ==\r\nAlbert Claude nait \u00e0 Longlier le 23 ao\u00fbt 1898 de Florentin Joseph Claude et Marie Glaudicine Watriquant. \u00c0 5 ans, sa famille part s'installer \u00e0 Athus o\u00f9 il suivra sa scolarit\u00e9 jusqu'\u00e0 l'\u00e2ge d'entrer \u00e0 l'universit\u00e9. Il obtient son dipl\u00f4me de m\u00e9decine \u00e0 l'Universit\u00e9 de Li\u00e8ge en 1928. En 1928-29 il m\u00e8ne des recherches \u00e0 Berlin, d'abord \u00e0 l'Institut f\u00fcr Krebsforschung, puis \u00e0 l'Institut de biologie Kaiser Wilhelm, \u00e0 Dahlem, dans le laboratoire du professeur Albert Fischer. Lors de l'\u00e9t\u00e9 1929, il rejoint l'Institut Rockefeller, o\u00f9 il continuera \u00e0 mener ses recherches jusqu'en 1950. Ses travaux d'alors r\u00e9v\u00e8lent pour la premi\u00e8re fois la nature, la composition chimique et la fonction enzymatique du cytoplasme de la cellule normale.\r\n\u00c0 contrec\u0153ur (\u00ab It was a mistake \u00bb dira-t-il plus tard), il quitte New York en 1950 pour accepter le poste de directeur scientifique de l'Institut Jules Bordet, institut de recherche en canc\u00e9rologie rattach\u00e9 \u00e0 la Facult\u00e9 de m\u00e9decine (o\u00f9 il fut nomm\u00e9 professeur, mais n'enseigna jamais) de l'Universit\u00e9 libre de Bruxelles (ULB). Il y cr\u00e9a le Laboratoire de Cytologie et de Canc\u00e9rologie exp\u00e9rimentale, qui contribua grandement \u00e0 la r\u00e9putation internationale de cet Institut. Apr\u00e8s son acc\u00e8s \u00e0 l'\u00e9m\u00e9ritat \u00e0 l'ULB en 1971, \u00e0 l'instigation de son coll\u00e8gue et ami Christian de Duve il rejoint l'Universit\u00e9 catholique de Louvain (UCL) qui le nomme professeur et cr\u00e9e pour lui \u00e0 Louvain-la-Neuve, en 1972, le Laboratoire de Biologie cellulaire et Canc\u00e9rologie dont il fut directeur. Il y transf\u00e9ra pour seul collaborateur le Dr Emil Mrena, avec lequel il travaillait depuis 1969. Mais son \u00e2ge et sa sant\u00e9 fragile ne lui permirent plus de se d\u00e9placer r\u00e9guli\u00e8rement jusqu'\u00e0 Louvain. Par manque d'activit\u00e9 au laboratoire, le Dr Mrena donna lui-m\u00eame sa d\u00e9mission en 1977 pour se consacrer \u00e0 d'autres travaux de recherche. Parall\u00e8lement \u00e0 l'universit\u00e9 catholique de Louvain, il fut aussi nomm\u00e9 professeur \u00e0 l'universit\u00e9 Rockefeller, institution avec laquelle il n'avait jamais cess\u00e9 d'\u00eatre associ\u00e9 depuis sa premi\u00e8re visite en 1929.\r\nD\u00e9j\u00e0 r\u00e9compens\u00e9s en 1960 d'un Prix quinquennal du FNRS, en 1970 du prix Louisa-Gross-Horwitz de l'universit\u00e9 Columbia, et en 1971 du prix Paul-Ehrlich-et-Ludwig-Darmstaedter, ses travaux sont couronn\u00e9s en 1974 par le prix Nobel de physiologie ou m\u00e9decine, occasion pour ce laur\u00e9at de r\u00e9diger une autobiographie tr\u00e8s atypique, tra\u00e7ant l'histoire de son village natal depuis l'\u00e9poque carolingienne et s'arr\u00eatant pour lui-m\u00eame \u00e0 son enfance, marqu\u00e9e par l'\u00e9pisode de la mort tragique de sa m\u00e8re d'un cancer du sein, m\u00eame s'il se d\u00e9fend in fine, en bon rationaliste, que celle-ci ait pu avoir quelque influence sur sa vocation scientifique.\r\nP\u00e8re d'une fille, Philippa, n\u00e9e d'un mariage contract\u00e9 lors de son long s\u00e9jour \u00e0 New York avec Julia Gilder (d\u00e9c\u00e9d\u00e9e en 1987), il s'\u00e9teignit le 22 mai 1983 dans sa maison d'Ixelles o\u00f9 il vivait, tr\u00e8s retir\u00e9, avec sa s\u0153ur et son fr\u00e8re qui l'aimaient et le choyaient.\r\n\r\n\r\n== Hommages ==\r\nLa commune de Neufch\u00e2teau lui a consacr\u00e9 une rue en 2005, proche de son lieu de naissance.\r\nUne rue d'Athus, ville de son enfance, porte \u00e9galement son nom.\r\nPlusieurs rues Albert-Claude\r\n\r\n\r\n== Notes et r\u00e9f\u00e9rences ==\r\n\r\n\r\n=== Notes ===\r\n\r\n\r\n=== R\u00e9f\u00e9rences ===\r\n\r\n\r\n== Voir aussi ==\r\n\r\n\r\n=== Bibliographie ===\r\nCl Gompel, \u00ab [Albert Claude, an exceptional man] \u00bb, Bull. Mem. Acad. R. Med. Belg., vol. 161, nos 10\u201312,\u200e 2006, p. 543\u201355 (PMID 17503730)\r\n(en) T N Raju, \u00ab The Nobel chronicles. 1974: Albert Claude (1899-1983), George Emil Palade (b 1912), and Christian R\u00e9ne de Duve (b 1917) \u00bb, Lancet, vol. 354, no 9185,\u200e octobre 1999, p. 1219 (PMID 10513750, DOI 10.1016\/S0140-6736(05)75433-7)\r\nH J Rheinberger, \u00ab Cytoplasmic particles in Brussels (Jean Brachet, Hubert Chantrenne, Raymond Jeener) and at Rockefeller (Albert Claude), 1935-1955 \u00bb, History and philosophy of the life sciences, vol. 19, no 1,\u200e 1997, p. 47\u201367 (PMID 9284642)\r\nJ Fr\u00fchling, \u00ab [Eulogy of Professor Albert Claude, Nobel Prize in Medicine and Physiology in 1974] \u00bb, Bull. Mem. Acad. R. Med. Belg., vol. 149, no 12,\u200e ao\u00fbt 1994, p. 466\u20139 (PMID 8563685)\r\nJ Brachet, \u00ab [Notice sur Albert Claude, Associ\u00e9 de l'Acad\u00e9mie] \u00bb, Annuaire de l'Acad\u00e9mie royale de Belgique,\u200e 1988, p. 93\u2013135 (lire en ligne)\r\nC de Duve, \u00ab [Albert Claude and the beginnings of modern cell biology] \u00bb, La Cellule, vol. 74,\u200e 1987, p. 11\u20139 (PMID 3079269)\r\nJ Henry, \u00ab [Eulogy to Professor Albert Claude, honorary member of the Royal Academy] \u00bb, Bull. Mem. Acad. R. Med. Belg., vol. 139, no 3,\u200e 1984, p. 197\u2013202 (PMID 6388698)\r\n(en) C. de Duve et G. E. Palade, \u00ab Albert Claude, 1899-1983 \u00bb, Nature, vol. 304, no 5927,\u200e 1983, p. 588 (PMID 6308471, DOI 10.1038\/304588a0)\r\n(en) H. Tagnon, \u00ab [In memoriam Prof. Albert Claude] \u00bb, Revue m\u00e9dicale de Bruxelles, vol. 4, no 6,\u200e juin 1983, p. 450\u20132 (PMID 6348913)\r\n(en) B. R. Olsen et S. O. Lie, \u00ab [Nobel prize in medicine 1974 (Albert Claude, George Palade, Christian de Duve)] \u00bb, Tidsskr. Nor. Laegeforen., vol. 94, nos 34\u201336,\u200e d\u00e9cembre 1974, p. 2400\u20133 (PMID 4614493)\r\n(en) M. Florkin, \u00ab [A salute to Albert Claude] \u00bb, Arch. Int. Physiol. Biochim., vol. 80, no 4,\u200e octobre 1972, p. 632\u201347 (PMID 4120117, DOI 10.3109\/13813457209075254)\r\n(en) M. Florkin, \u00ab [Homage to Albert Claude and Christian de Duve, Nobel Prize laureates in medicine and physiology, 1974] \u00bb, Arch. Int. Physiol. Biochim., vol. 82, no 5,\u200e d\u00e9cembre 1974, p. 807\u201315 (PMID 4142698, DOI 10.3109\/13813457409072328)\r\n(en) G. E. Palade, \u00ab Albert Claude and the beginnings of biological electron microscopy \u00bb, J. Cell Biol., vol. 50, no 1,\u200e juillet 1971, p. 5d\u201319d (PMID 4935221, DOI 10.1083\/jcb.50.1.5d)\r\n\r\n\r\n=== Liens externes ===\r\nListe de publications sur le d\u00e9p\u00f4t institutionnel de l'Universit\u00e9 libre de Bruxelles\r\nAlbert Claude (1899-1983), Institut Jules Bordet\r\n(en) Autobiographie sur le site de la fondation Nobel (le bandeau sur la page comprend plusieurs liens relatifs \u00e0 la remise du prix, dont un document r\u00e9dig\u00e9 par la personne laur\u00e9ate \u2014 le Nobel Lecture \u2014 qui d\u00e9taille ses apports)\r\n\r\nRessources relatives \u00e0 la recherche : Acad\u00e9mie royale de m\u00e9decine de Belgique La France savante \r\nRessource relative \u00e0 la sant\u00e9 : Biblioth\u00e8que interuniversitaire de sant\u00e9 \r\n Portail de la m\u00e9decine   Portail du prix Nobel   Portail de la biochimie   Portail de la Belgique   Portail de la Wallonie   Portail de la province de Luxembourg   Portail des \u00c9tats-Unis","mots_cles":"albert;claude;ne;le;23;aout;1898;a;longlier;en;belgique;et;mort;le;22;mai;1983;a;ixelles;en;belgique;est;un;biochimiste;belge;naturalise;americain;en;1941;precurseur;dans;le;domaine;de;la;biologie;moleculaire;il;est;le;corecipiendaire;en;1974;du;prix;nobel;de;physiologie;ou;medecine;avec;christian;de;duve;et;george;emil;palade;pour;leur;decouverte;dultrastructures;cellulaires;;biographie;;albert;claude;nait;a;longlier;le;23;aout;1898;de;florentin;joseph;claude;et;marie;glaudicine;watriquant;a;5;ans;sa;famille;part;sinstaller;a;athus;ou;il;suivra;sa;scolarite;jusqua;lage;dentrer;a;luniversite;il;obtient;son;diplome;de;medecine;a;luniversite;de;liege;en;1928;en;192829;il;mene;des;recherches;a;berlin;dabord;a;linstitut;fur;krebsforschung;puis;a;linstitut;de;biologie;kaiser;wilhelm;a;dahlem;dans;le;laboratoire;du;professeur;albert;fischer;lors;de;lete;1929;il;rejoint;linstitut;rockefeller;ou;il;continuera;a;mener;ses;recherches;jusquen;1950;ses;travaux;dalors;revelent;pour;la;premiere;fois;la;nature;la;composition;chimique;et;la;fonction;enzymatique;du;cytoplasme;de;la;cellule;normale;a;contrecur;;it;was;a;mistake;;diratil;plus;tard;il;quitte;new;york;en;1950;pour;accepter;le;poste;de;directeur;scientifique;de;linstitut;jules;bordet;institut;de;recherche;en;cancerologie;rattache;a;la;faculte;de;medecine;ou;il;fut;nomme;professeur;mais;nenseigna;jamais;de;luniversite;libre;de;bruxelles;ulb;il;y;crea;le;laboratoire;de;cytologie;et;de;cancerologie;experimentale;qui;contribua;grandement;a;la;reputation;internationale;de;cet;institut;apres;son;acces;a;lemeritat;a;lulb;en;1971;a;linstigation;de;son;collegue;et;ami;christian;de;duve;il;rejoint;luniversite;catholique;de;louvain;ucl;qui;le;nomme;professeur;et;cree;pour;lui;a;louvainlaneuve;en;1972;le;laboratoire;de;biologie;cellulaire;et;cancerologie;dont;il;fut;directeur;il;y;transfera;pour;seul;collaborateur;le;dr;emil;mrena;avec;lequel;il;travaillait;depuis;1969;mais;son;age;et;sa;sante;fragile;ne;lui;permirent;plus;de;se;deplacer;regulierement;jusqua;louvain;par;manque;dactivite;au;laboratoire;le;dr;mrena;donna;luimeme;sa;demission;en;1977;pour;se;consacrer;a;dautres;travaux;de;recherche;parallelement;a;luniversite;catholique;de;louvain;il;fut;aussi;nomme;professeur;a;luniversite;rockefeller;institution;avec;laquelle;il;navait;jamais;cesse;detre;associe;depuis;sa;premiere;visite;en;1929;deja;recompenses;en;1960;dun;prix;quinquennal;du;fnrs;en;1970;du;prix;louisagrosshorwitz;de;luniversite;columbia;et;en;1971;du;prix;paulehrlichetludwigdarmstaedter;ses;travaux;sont;couronnes;en;1974;par;le;prix;nobel;de;physiologie;ou;medecine;occasion;pour;ce;laureat;de;rediger;une;autobiographie;tres;atypique;tracant;lhistoire;de;son;village;natal;depuis;lepoque;carolingienne;et;sarretant;pour;luimeme;a;son;enfance;marquee;par;lepisode;de;la;mort;tragique;de;sa;mere;dun;cancer;du;sein;meme;sil;se;defend;in;fine;en;bon;rationaliste;que;celleci;ait;pu;avoir;quelque;influence;sur;sa;vocation;scientifique;pere;dune;fille;philippa;nee;dun;mariage;contracte;lors;de;son;long;sejour;a;new;york;avec;julia;gilder;decedee;en;1987;il;seteignit;le;22;mai;1983;dans;sa;maison;dixelles;ou;il;vivait;tres;retire;avec;sa;sur;et;son;frere;qui;laimaient;et;le;choyaient;;hommages;;la;commune;de;neufchateau;lui;a;consacre;une;rue;en;2005;proche;de;son;lieu;de;naissance;une;rue;dathus;ville;de;son;enfance;porte;egalement;son;nom;plusieurs;rues;albertclaude;;notes;et;references;;;notes;;;references;;;voir;aussi;;;bibliographie;;cl;gompel;;albert;claude;an;exceptional;man;;bull;mem;acad;r;med;belg;vol;161;nos;1012;2006;p;54355;pmid;17503730;en;t;n;raju;;the;nobel;chronicles;1974;albert;claude;18991983;george;emil;palade;b;1912;and;christian;rene;de;duve;b;1917;;lancet;vol;354;no;9185;octobre;1999;p;1219;pmid;10513750;doi;101016s0140673605754337;h;j;rheinberger;;cytoplasmic;particles;in;brussels;jean;brachet;hubert;chantrenne;raymond;jeener;and;at;rockefeller;albert;claude;19351955;;history;and;philosophy;of;the;life;sciences;vol;19;no;1;1997;p;4767;pmid;9284642;j;fruhling;;eulogy;of;professor;albert;claude;nobel;prize;in;medicine;and;physiology;in;1974;;bull;mem;acad;r;med;belg;vol;149;no;12;aout;1994;p;4669;pmid;8563685;j;brachet;;notice;sur;albert;claude;associe;de;lacademie;;annuaire;de;lacademie;royale;de;belgique;1988;p;93135;lire;en;ligne;c;de;duve;;albert;claude;and;the;beginnings;of;modern;cell;biology;;la;cellule;vol;74;1987;p;119;pmid;3079269;j;henry;;eulogy;to;professor;albert;claude;honorary;member;of;the;royal;academy;;bull;mem;acad;r;med;belg;vol;139;no;3;1984;p;197202;pmid;6388698;en;c;de;duve;et;g;e;palade;;albert;claude;18991983;;nature;vol;304;no;5927;1983;p;588;pmid;6308471;doi;101038304588a0;en;h;tagnon;;in;memoriam;prof;albert;claude;;revue;medicale;de;bruxelles;vol;4;no;6;juin;1983;p;4502;pmid;6348913;en;b;r;olsen;et;s;o;lie;;nobel;prize;in;medicine;1974;albert;claude;george;palade;christian;de;duve;;tidsskr;nor;laegeforen;vol;94;nos;3436;decembre;1974;p;24003;pmid;4614493;en;m;florkin;;a;salute;to;albert;claude;;arch;int;physiol;biochim;vol;80;no;4;octobre;1972;p;63247;pmid;4120117;doi;10310913813457209075254;en;m;florkin;;homage;to;albert;claude;and;christian;de;duve;nobel;prize;laureates;in;medicine;and;physiology;1974;;arch;int;physiol;biochim;vol;82;no;5;decembre;1974;p;80715;pmid;4142698;doi;10310913813457409072328;en;g;e;palade;;albert;claude;and;the;beginnings;of;biological;electron;microscopy;;j;cell;biol;vol;50;no;1;juillet;1971;p;5d19d;pmid;4935221;doi;101083jcb5015d;;liens;externes;;liste;de;publications;sur;le;depot;institutionnel;de;luniversite;libre;de;bruxelles;albert;claude;18991983;institut;jules;bordet;en;autobiographie;sur;le;site;de;la;fondation;nobel;le;bandeau;sur;la;page;comprend;plusieurs;liens;relatifs;a;la;remise;du;prix;dont;un;document;redige;par;la;personne;laureate;;le;nobel;lecture;;qui;detaille;ses;apports;ressources;relatives;a;la;recherche;;academie;royale;de;medecine;de;belgique;la;france;savante;ressource;relative;a;la;sante;;bibliotheque;interuniversitaire;de;sante;portail;de;la;medecine;portail;du;prix;nobel;portail;de;la;biochimie;portail;de;la;belgique;portail;de;la;wallonie;portail;de;la;province;de;luxembourg;portail;des;etatsunis","nom_organisation":"Universit\u00e9 Catholique de Louvain","ville_organisation":"Louvain","pays_organisation":"Belgium"}
>>>>>>> Stashed changes
